{
  "$schema": "http://json-schema.org/draft-07/schema#",
  "type": "object",
  "properties": {
    "generatedFiles": {
      "type": "array",
      "items": { "type": "string" }
    },
    "coverage": {
      "type": "array",
      "items": { "type": "string" }
    },
    "assumptions": {
      "type": "array",
      "items": { "type": "string" }
    },
    "warnings": {
      "type": "array",
      "items": { "type": "string" }
    }
  },
  "required": ["generatedFiles", "coverage", "assumptions", "warnings"]
}
